"conversation_id_str","created_at","favorite_count","full_text","id_str","image_url","in_reply_to_screen_name","lang","location","quote_count","reply_count","retweet_count","tweet_url","user_id_str","username"
"1214857986440491010","Wed Jan 08 10:34:49 +0000 2020","0","tuhhhhh dengerin pujaan klean ngomong apa!!! BANJIR ITU URUSAN PEMERINTAH PUSAT!!! jadi yang mau makzulin @aniesbaswedan gegara banjir langsung mentah yeeee https://t.co/MQvY3EtU1E","1214857986440491010","","","in","temple of doom","0","0","0","https://x.com/gyuvenchy0428/status/1214857986440491010","108169482","gyuvenchy0428"
"1214758658317250560","Wed Jan 08 10:31:53 +0000 2020","0","@jr_kw19 Class action gak ada jalan lain. Mmg indikasinya jelas: pimpinan daerah lalai dlm mengantisipasi banjir padahal BMKG dan bbrp pihak lain sdh menyampaikan prediksi cuaca kpd pemerintah.","1214857246162612225","","jr_kw19","in","Indonesia","0","0","0","https://x.com/justright891/status/1214857246162612225","232803730","justright891"
"1214856429711945728","Wed Jan 08 10:28:38 +0000 2020","3","Anggota Komisi V DPR RI Fraksi Partai NasDem Tamanuri menegaskan masalah banjir adalah musibah bersama bangsa ini. Sinergitas antara lembaga lembaga terkait dan pemerintah daerah terkait dengan mitigasi bencana harus lebih diperhatikan. Pesan Tamanuri. #NasDemAntiMahar https://t.co/8aRRkkChrS","1214856429711945728","https://pbs.twimg.com/media/ENwJeh7U8AAittj.jpg","","in","ÜT: -6.177799,106.843475","0","2","1","https://x.com/NasDem/status/1214856429711945728","109149190","NasDem"
"1214853279223410688","Wed Jan 08 10:16:07 +0000 2020","2","Saat ini alokasi dana tak terduga untuk banjir sudah digelontorkan sekitar Rp 6 miliar oleh Pemerintah Kota Bekasi. https://t.co/Xbfs5zdAcs","1214853279223410688","","","in","Jakarta","0","0","0","https://x.com/kompascom/status/1214853279223410688","23343960","kompascom"
"1214848897605980160","Wed Jan 08 09:58:42 +0000 2020","1","Pemerintah Provinsi DKI Jakarta mewaspadai adanya banjir akibat luapan air laut atau rob di utara Jakarta https://t.co/ppwyFFUAnO","1214848897605980160","","","in","Indonesia","0","1","0","https://x.com/tempodotco/status/1214848897605980160","18129942","tempodotco"
"1214803953650720768","Wed Jan 08 07:00:07 +0000 2020","0","Pemerintah Kota Makassar Siaga Bencana Banjir https://t.co/X9WciwsFgf","1214803953650720768","","","in","Makassar, Indonesia","0","0","0","https://x.com/Media_Sulselta/status/1214803953650720768","1096445591792496641","Media_Sulselta"
"1214803112055042049","Wed Jan 08 06:56:46 +0000 2020","198","Demi keselamatan rakyat Jokowi ambil komando atas penanggulangan banjir sebagai bentuk tanggung jawab pemerintah pusat yaitu membangun terowongan Nanjung (Citarum Harum) dan Bendungan Sukamahi-Ciawi. Lalu kenapa cuma Jakarta yang menjadi sorotan??? #GantiGubernurDKI https://t.co/CASxVNuwlj","1214803112055042049","https://pbs.twimg.com/media/ENvY_QEUcAAIlI-.jpg","","in","","9","89","73","https://x.com/kanyaaputriii/status/1214803112055042049","1140479025720131584","kanyaaputriii"
"1214357438209519616","Wed Jan 08 06:48:34 +0000 2020","0","@riza_ajir @Galinggaling2 @CNNIndonesia Ini yang terbukti penyebab langsung banjir yg adalah proyek pemerintah pusat seharusnya yg dituntut itu kalau punya otak udah gini AMDAL kok mau dihapus untuk investasi pemerintah parah https://t.co/zxdX3ni7hG","1214801050311376896","","KebenaranHakiky","in","","0","1","0","https://x.com/KebenaranHakiky/status/1214801050311376896","133277792","KebenaranHakiky"
"1214794480936579072","Wed Jan 08 06:22:29 +0000 2020","6","Dari peninjauan langsung yang saya lakukan berkali-kali memang tampak bahwa Pemprov DKI kurang sigap dalam mengatasi bencana banjir tersebut. Tidak cepat tanggap tanggap daruratnya pemerintah daerah tidak terlihat dan juga persiapan-persiapannya tidak lihat.","1214794486154293248","","PrasetyoEdi_","in","Jakarta Capital Region","1","1","6","https://x.com/PrasetyoEdi_/status/1214794486154293248","1088295819617267713","PrasetyoEdi_"
"1214794480936579072","Wed Jan 08 06:22:29 +0000 2020","4","Dan sudah menjadi kewajiban pemerintah untuk menuntaskan berbagai permasalahan yang dialami warga salah satunya ancaman banjir ini.","1214794484732420096","","PrasetyoEdi_","in","Jakarta Capital Region","0","1","3","https://x.com/PrasetyoEdi_/status/1214794484732420096","1088295819617267713","PrasetyoEdi_"
"1214792763239043072","Wed Jan 08 06:15:39 +0000 2020","6","Peringatan dini Potensi Ancaman Bahaya Banjir &amp; Tanah Longsor di Indonesia oleh @BNPB_Indonesia https://t.co/Yf3bPY5UCk","1214792763239043072","https://pbs.twimg.com/media/ENvPc3jU8AAW2et.jpg","","in","Gedung Balai Kota Depok","0","0","8","https://x.com/pemkotdepok/status/1214792763239043072","130723905","pemkotdepok"
"1214791723575959553","Wed Jan 08 06:11:31 +0000 2020","7","Disdukcapil Kota Depok menyerahkan Kartu Keluarga E-KTP dan Akta Kematian kepada korban bencana banjir dan longsor di Kelurahan Pangkalan Jati Baru Cinere Rabu (08/01/2020) https://t.co/qfHCZ1olnx","1214791723575959553","https://pbs.twimg.com/media/ENvOfovVAAEE5ha.jpg","","in","Gedung Balai Kota Depok","0","2","0","https://x.com/pemkotdepok/status/1214791723575959553","130723905","pemkotdepok"
"1214789482991349760","Wed Jan 08 06:02:37 +0000 2020","0","Menko PMK: Pemerintah Beri Santunan Rp 500 Ribu Perbulan Bagi Korban Banjir https://t.co/wOLgQcZYsa","1214789482991349760","","","in","Cirebon, Jawa Barat, Indonesia","0","0","0","https://x.com/pubinform/status/1214789482991349760","2449382456","pubinform"
"1214730920999079936","Wed Jan 08 05:52:50 +0000 2020","0","@yoeandha01 @kurawa @ridwankamil Jabar &amp; DKI punya tugas masing masing. Begitu jg pemerintah pusat &amp; DKI. Daripada gabener nunggu pusat beres kerja bukankah sebaiknya dia urusin saja dulu yg kerjaan bagian wilayah dia? Jgn ky sekarang begitu banjir bilangnya apapun yg jkt lakukan pasti akan tetap banjir.","1214787024244183040","","yoeandha01","in","","0","0","0","https://x.com/Jimmy_Motz/status/1214787024244183040","890481787360563200","Jimmy_Motz"
"1214783240923254784","Wed Jan 08 05:37:48 +0000 2020","0","Pemerintah Silahkan rusak lingkungan asal jangan mengganggu investasi asing giliran kena bencana mala bilang warga masyarakat harus sadar dengan lingkungan agar gak jadi banjir lah terus situ sendiri merusak gimana sih kok warga yang di wanti wanti.","1214783240923254784","","","in","Planet Mars","0","0","0","https://x.com/Imamrachmat23/status/1214783240923254784","1192120652","Imamrachmat23"
"1213961833289138176","Wed Jan 08 05:08:56 +0000 2020","0","@fadlizon Jubir rakyat kemana lari kok banjir melanda jakarta sampai ada korban jiwa gak ada ngomong pembersihan pasca banjir tdk d bantu pemerintah daerah lagi... Biar tdk peecuma jd jubir rakyat","1214775973587169285","","fadlizon","in","","0","0","0","https://x.com/Boy84532161/status/1214775973587169285","1173580369259454464","Boy84532161"
"1214472634101977088","Wed Jan 08 04:48:26 +0000 2020","0","@dickyrevolution @muhjayz @dr_tompi saya cuma mengajak ke kota mas nya yg lebih menarik untuk dibahas ketimbang ngebahas pemerintah kota jakarta yang lemah yakan? kalo objektif mah anies biasa aja dibawah Ahok malah cuma pemerintah kota bekasi juga butuh kritk terlebih kasus banjir tahun ini","1214770816073625600","","dickyrevolution","in","Jakarta Selatan, DKI Jakarta","0","0","0","https://x.com/fkrlfjr/status/1214770816073625600","211050608","fkrlfjr"
"1214769646915571712","Wed Jan 08 04:43:47 +0000 2020","0","Rivalitas BTP &amp; Anies Tak Bisa Selesaikan Banjir di Jakarta https://t.co/VRsJdsMRaL via @TirtoID Gak usah lah terbawa suasana. Mending kasih masukan ke pemerintah dan legislatif biar penanggulangan banjir bisa lebih baik.","1214769646915571712","","","in","under the bridge.","0","0","0","https://x.com/pawbapaw/status/1214769646915571712","246083765","pawbapaw"
"1214767449075150848","Wed Jan 08 04:35:03 +0000 2020","0","12 pemerintah daerah ini tetapkan status tanggap darurat setelah dilanda banjir https://t.co/8GNUh9JJU9 #Banjir","1214767449075150848","","","in","Jakarta, Indonesia","0","0","0","https://x.com/KontanNews/status/1214767449075150848","43799886","KontanNews"
"1214748206048768000","Wed Jan 08 03:18:35 +0000 2020","0","LIPI: Pemerintah perlu evaluasi infrastruktur dan mitigasi banjir Jabodetabek https://t.co/VO4taYEFJR","1214748206048768000","","","in","Jakarta Capital Region","0","0","0","https://x.com/AnadoluAgencyID/status/1214748206048768000","894492750070022144","AnadoluAgencyID"
"1214747301488578560","Wed Jan 08 03:15:00 +0000 2020","1","Ribuan korban banjir masih huni posko pengungsian. Pemerintah berikan bantuan uang sewa Rp500 ribu dan bantuan uang hingga Rp50 juta untuk perbaikan rumah. Saksikan selengkapnya di kanal YouTube Seputar iNews! https://t.co/p7pbvyRxlj #SeputariNewsPagi #Banjir2020 https://t.co/SKrcgFokIY","1214747301488578560","https://pbs.twimg.com/amplify_video_thumb/1214740330802606080/img/a8Cvr429oW1BdHGk.jpg","","in","iNews Tower","0","0","2","https://x.com/officialinews_/status/1214747301488578560","132078023","officialinews_"
"1214511760599744513","Wed Jan 08 02:59:18 +0000 2020","0","@VIVAcoid Banjir kok nyalahin pemerintah warganya sendiri gimana?","1214743352236621824","","VIVAcoid","in","Surabaya, Indonesia","0","1","0","https://x.com/AlfanAlamsyah/status/1214743352236621824","379564810","AlfanAlamsyah"
"1214734790525501440","Wed Jan 08 02:53:22 +0000 2020","4","@Reiza_Patters Hahaha... pusyiiingg pak polisinya... perlu piknik nih kayaknya... dan bukankah sudah ada UU yg mengatur tentang bentuk tanggung jawab pemerintah bila terjadi bencana banjir...? silahkan di cek sesuai UU yg berlaku jgn pakai asumsi apalagi opini yg nggak jelas... https://t.co/JS44AMbNEf","1214741859861331968","https://pbs.twimg.com/media/ENuhR_rUwAA6umo.jpg","Reiza_Patters","in","Boyolali-Ngawi-Jakarta-Tokyo","0","0","2","https://x.com/Irnawati_Siti_I/status/1214741859861331968","321900113","Irnawati_Siti_I"
"1214472634101977088","Wed Jan 08 02:52:06 +0000 2020","1","@OnHisar @inne_170980 @agus_tty @nayalvv @dr_tompi @aniesbaswedan Ya bicara ikhtiar mah jaman jkw Ahok udah ikhtiar semua itu. Waduk ria Rio normalisasi ini pemerintah pusat juga bikin waduk. Nah pertinyiinyi. @aniesbaswedan sejak dilantik udah bikin apa selain mangkas anggaran banjir? Itu ikhtiar pencegahan banjir?","1214741537654853632","","OnHisar","in","","0","2","0","https://x.com/UstanakKun/status/1214741537654853632","1072970091765977091","UstanakKun"
"1214740409856843776","Wed Jan 08 02:47:37 +0000 2020","0","Adapun untuk mempercepat penanganan sampah dan lumpur pasca- banjir Pemkot Bekasi telah menyewa sebanyak 65 truk untuk membantu pengangkutan sampah ke TPA Sumurbatu. Pemerintah sendiri sejak banjir surut telah menyiagakan 307 truk sampah.","1214740409856843776","","","in","Jakarta, Indonesia","0","0","0","https://x.com/didienAZHAR/status/1214740409856843776","194590819","didienAZHAR"
"1214736243369447425","Wed Jan 08 02:31:03 +0000 2020","8","Dampak dari banjir yang melanda wilayah Jakarta Bekasi dan Jawa Barat masih berdampak hingga hari ini. Pemerintah melalui Menko PMK akan memberikan dana tunggu bagi warga yang rumahnya rusak. #Liputan6SCTV https://t.co/KeyaCJdyHl","1214736243369447425","https://pbs.twimg.com/media/ENubBeFUwAAh9vF.png","","in","","0","0","2","https://x.com/SCTV/status/1214736243369447425","174601238","SCTV"
"1214733016859168769","Wed Jan 08 02:24:24 +0000 2020","0","@CNNIDdaily @jokowi Yes Pemerintah Daerah diwilayah yg kena bencana banjir harap full konsentrasi penanganan masa darurat banjir dengan cepat dan efektif agar kehidupan masyarakat bisa normal kembali.","1214734568596467714","","CNNIDdaily","in","Kota Jogja,DIY,Indonesia","0","0","0","https://x.com/herry_zudianto/status/1214734568596467714","170171658","herry_zudianto"
"1214410099592028161","Wed Jan 08 02:20:03 +0000 2020","0","@MuhVidic @topazaditia @Pejuang_Langit @seruanhl @aniesbaswedan Baca dulu donk. Gimana banjir bisa teratasi klo pemda nya nga mau kerja sama dengan pemerintah pusat. Dua kali gubernur di undang oleh kementerian pupr. Tapi yang hadir malah perwakilan. Itu pun perwakilan nya nga ngerti apa apa","1214733474482900992","","MuhVidic","in","Makassar-Indonesia","0","0","0","https://x.com/jumaidilkidil/status/1214733474482900992","2378195082","jumaidilkidil"
"1214573110944387077","Wed Jan 08 02:18:54 +0000 2020","0","@Q1ran14yar4 Sekalian pak usut jln yol japek yg banjir katanya gegara proyek pemerintah","1214733183670837248","","Qiaranie","in","","0","0","0","https://x.com/satria2401/status/1214733183670837248","810482812679618560","satria2401"
"1214727829931216896","Wed Jan 08 01:57:37 +0000 2020","0","Prediksi Banjir Rob Jakarta Anies Siagakan alat dan personel Pemerintah Provinsi DKI Jakarta sedang mengantisipasi banjir kiriman dan rob yang mengancam Jakarta. #MorningVoice","1214727829931216896","","","in","Jakarta","0","1","0","https://x.com/BVOICE_RADIO/status/1214727829931216896","74664107","BVOICE_RADIO"
"1214725883698667520","Wed Jan 08 01:49:53 +0000 2020","2","Baca dongs tulisan pertama saya yang dimuat Mojok hwhw. Protes ke Pemerintah Soal Banjir Jakarta itu Sah-sah Aja Dong https://t.co/KE36PIEFtU via @mojokdotco","1214725883698667520","","","in","pale blue dot","0","1","0","https://x.com/bachtiarsjam/status/1214725883698667520","79126454","bachtiarsjam"
"1214724538295975937","Wed Jan 08 01:44:33 +0000 2020","0","#Banjir Sikat #Jakarta #Anies Salahkan #Ahok Dan Pemerintah Pusat https://t.co/NotdLSgbtv #moreshareforum #beritaterkini","1214724538295975937","","","in","Indonesian Forum Community","0","0","0","https://x.com/moreshare/status/1214724538295975937","71512327","moreshare"
"1214664000375406592","Wed Jan 08 01:42:03 +0000 2020","0","@mohmahfudmd @makLambeTurah pak mahfud tolonglah minta presiden untuk lebih peka terhadap issue yg ada di masyarakat saat ini terlebih dalam hal issue SARA agar tidak terkesan pembiaran oleh pemerintah. sangat disayangkan lemahnya fungsi kuasa presiden thd hal yg meresahkan issue banjir dll. thx ya","1214723909984980992","","mohmahfudmd","in","","0","0","0","https://x.com/AldenBenny/status/1214723909984980992","4736940102","AldenBenny"
"1214472634101977088","Wed Jan 08 01:40:29 +0000 2020","1","@dr_tompi Menurut Gub @aniesbaswedan ... seluruh lahan perkantoran pemerintah di DKI sdh adopsi konsep zero rum off. Tapi mengapa Jakarta masih banjir ya pak #stupidquestion","1214723517628833792","","dr_tompi","in","Surabaya, Indonesia","0","0","0","https://x.com/puturudy/status/1214723517628833792","151804263","puturudy"
"1214715372189782016","Wed Jan 08 01:19:07 +0000 2020","10","@kurawa Ntar kalau banjir tinggal salahkan pemerintah pusat yg belum selesaikan waduk salahkan jokowi yg janji kalau jadi presiden bisa mengatasi banjir salahkan hujan yg turun lebat mengatasi banjir? Emang gw pikirin....by wan abud","1214718139788746752","","kurawa","in","Indonesia","0","0","4","https://x.com/jobbysilputra/status/1214718139788746752","158012383","jobbysilputra"
"1214716292189409280","Wed Jan 08 01:11:47 +0000 2020","2","Dengan adanya class action ini pemerintah dapat mengganti kerugian warga yang diderita akibat banjir. https://t.co/F359EJXDPI","1214716292189409280","","","in","Jakarta - Indonesia","0","0","1","https://x.com/mediaindonesia/status/1214716292189409280","68930552","mediaindonesia"
"1214699154900836354","Wed Jan 08 00:52:28 +0000 2020","2","Lalu kita lihat lagi Dan lagi-2 kendali penanganan banjir akhirnya diambil oleh pemerintah pusat.. Lalu..gabener gmn ??? Dia kerja bakti.. sambil asik ngevlog dgn rodiyah Sbg bhn tebar pesona dimedia.. #Gugat4niesGantiRugi","1214711432077381634","","Mi9aWempy","in","akun ke...(lupa) 🤦, Indonesia","0","0","0","https://x.com/Mi9aWempy/status/1214711432077381634","990916402797146113","Mi9aWempy"
"1214709227526086656","Wed Jan 08 00:43:42 +0000 2020","3","Pemerintah banjir kritik karena memilih diplomasi damai menghadapi polemik masuknya kapal Cina ke Kepulauan Natuna https://t.co/Jj9D8x8gNe","1214709227526086656","","","in","Indonesia","0","3","3","https://x.com/tempodotco/status/1214709227526086656","18129942","tempodotco"
